{"schema":"game-drive-visual-classification-v1","checkpoint_id":"capability_behavior_accel_otringal_normal","matches":true,"confidence":"high","summary":"Twinsen is visible near the lower center of the live game view, facing into an open outdoor Otringal walking area with clear space ahead. The target area is visible and not blocked by an immediate wall, dialog, or menu. The UI state is gameplay because the scene shows the active 3D game world with no overlay menus. No unsafe pose signs are visible; Twinsen appears upright and normally positioned.","observed":{"twinsen_visible":true,"target_visible":true,"ui_state":"gameplay","unsafe_pose_signs":false},"mismatches":[]}