{"schema":"game-drive-visual-classification-v1","checkpoint_id":"capability_behavior_speed_sporty","matches":true,"confidence":"high","summary":"Twinsen is visible standing in the Emerald Moon room, the row of three switches is visible ahead/left of him with the middle switch clearly present, and the screen is in normal gameplay with no dialog or menu overlays. Twinsen appears upright and stable with no unsafe pose signs.","observed":{"twinsen_visible":true,"target_visible":true,"ui_state":"gameplay","unsafe_pose_signs":false},"mismatches":[]}