{"schema":"game-drive-visual-classification-v1","checkpoint_id":"capability_behavior_speed_aggressive","matches":true,"confidence":"high","summary":"Twinsen is visible standing in the Moon switch room, the three pedestal switches are visible ahead of him with the middle switch clearly present, and the scene is normal gameplay with no dialog or menu overlay. Twinsen appears upright and stable, with no unsafe pose signs such as falling, clipping, or being stuck.","observed":{"twinsen_visible":true,"target_visible":true,"ui_state":"gameplay","unsafe_pose_signs":false},"mismatches":[]}