{"schema":"game-drive-visual-classification-v1","checkpoint_id":"capability_behavior_accel_otringal_sporty","matches":true,"confidence":"high","summary":"Twinsen is visible near the lower center of the live capture, facing into an open outdoor Otringal walking area. The target space ahead is open enough for forward movement, with no immediate wall, dialog, or menu blocking gameplay. The UI is in gameplay state and Twinsen shows no unsafe pose signs such as falling, clipping, incapacitation, or being stuck.","observed":{"twinsen_visible":true,"target_visible":true,"ui_state":"gameplay","unsafe_pose_signs":false},"mismatches":[]}