{"schema":"game-drive-visual-classification-v1","checkpoint_id":"capability_behavior_accel_otringal_discreet","matches":true,"confidence":"high","summary":"Twinsen is visible near the lower center of the live game view, facing into an open outdoor Otringal walking area. The target space ahead is open and unobstructed enough for movement, the UI is normal gameplay with no dialog or menu overlay, and there are no unsafe pose signs such as falling, clipping, or incapacitation.","observed":{"twinsen_visible":true,"target_visible":true,"ui_state":"gameplay","unsafe_pose_signs":false},"mismatches":[]}