{"schema":"game-drive-visual-classification-v1","checkpoint_id":"capability_behavior_speed_pose2_sporty","matches":true,"confidence":"high","summary":"Twinsen is visible in the Emerald Moon switch room, the three switches are visible ahead of him with the middle switch clearly present, and the screen is in normal gameplay with no dialog or menu overlays. Twinsen is standing/walking normally and shows no unsafe pose signs.","observed":{"twinsen_visible":true,"target_visible":true,"ui_state":"gameplay","unsafe_pose_signs":false},"mismatches":[]}