{"schema":"game-drive-visual-classification-v1","checkpoint_id":"capability_behavior_speed_normal","matches":true,"confidence":"high","summary":"Twinsen is visible standing in the Emerald Moon switch room, the three pedestal/wall switches are visible with the middle switch clearly present, and the screen is in normal gameplay with no dialog or menu overlay. Twinsen is upright and idle/standing, with no unsafe pose signs observed.","observed":{"twinsen_visible":true,"target_visible":true,"ui_state":"gameplay","unsafe_pose_signs":false},"mismatches":[]}