{"schema":"game-drive-visual-classification-v1","checkpoint_id":"capability_behavior_accel_discreet","matches":true,"confidence":"high","summary":"Twinsen is visible standing in the Emerald Moon room, the three pedestal switches are visible ahead/left of him with the middle switch clearly in view, and the screen is in normal gameplay with no dialog or menu overlay. Twinsen is upright and not in an unsafe or abnormal pose, so unsafe_pose_signs is false.","observed":{"twinsen_visible":true,"target_visible":true,"ui_state":"gameplay","unsafe_pose_signs":false},"mismatches":[]}