{"schema":"game-drive-visual-classification-v1","checkpoint_id":"capability_behavior_speed_pose2_aggressive","matches":true,"confidence":"high","summary":"Twinsen is visible in the Emerald Moon room near the three pedestal switches, and the middle switch target is visible among them. The screen is in normal gameplay with no dialog or menu overlay. Twinsen appears upright and controllable, with no unsafe pose signs such as falling, damage pose, or being stuck.","observed":{"twinsen_visible":true,"target_visible":true,"ui_state":"gameplay","unsafe_pose_signs":false},"mismatches":[]}