{"schema":"game-drive-visual-classification-v1","checkpoint_id":"capability_behavior_speed_pose2_normal","matches":true,"confidence":"high","summary":"Twinsen is visible standing in the Emerald Moon room, the row of three pedestal switches is visible ahead of him with the middle switch clearly present, and the screen is in gameplay with no dialog or menu UI. Twinsen appears upright and normally posed, with no unsafe pose signs.","observed":{"twinsen_visible":true,"target_visible":true,"ui_state":"gameplay","unsafe_pose_signs":false},"mismatches":[]}