{"schema":"game-drive-visual-classification-v1","checkpoint_id":"capability_behavior_accel_aggressive","matches":true,"confidence":"high","summary":"Twinsen is visible near the center-left of the gameplay scene, facing the row of three pedestal switches. The target middle switch is visible among the three switches on the left side of the room. The UI state is gameplay because the live game view is unobstructed with no dialog or menu overlays. No unsafe pose signs are visible; Twinsen appears standing normally.","observed":{"twinsen_visible":true,"target_visible":true,"ui_state":"gameplay","unsafe_pose_signs":false},"mismatches":[]}