{"schema":"game-drive-visual-classification-v1","checkpoint_id":"capability_behavior_speed_pose2_discreet","matches":true,"confidence":"high","summary":"Twinsen is visible standing in the Emerald Moon switch room, the middle switch among the three visible pedestal switches is clearly in view, the screen is normal gameplay with no menu or dialog overlay, and Twinsen shows no unsafe pose signs such as falling, damage, or being stuck.","observed":{"twinsen_visible":true,"target_visible":true,"ui_state":"gameplay","unsafe_pose_signs":false},"mismatches":[]}