{"schema":"game-drive-visual-classification-v1","checkpoint_id":"capability_behavior_accel_sporty","matches":true,"confidence":"high","summary":"Twinsen is visible standing in the Emerald Moon room, and the three pedestal switches are visible ahead/left of him with the middle switch identifiable. The screen is in normal gameplay view with no dialog or menu overlay. Twinsen is upright and idle/walking normally, with no unsafe pose signs.","observed":{"twinsen_visible":true,"target_visible":true,"ui_state":"gameplay","unsafe_pose_signs":false},"mismatches":[]}