{"schema":"game-drive-visual-classification-v1","checkpoint_id":"capability_behavior_direct_f5_f8","matches":true,"confidence":"high","summary":"Twinsen is visible standing in the Emerald Moon room near the center-left. The three pedestal/wall switches are visible ahead of him on the left side, including the middle switch, so the target switch is visible. The view is normal gameplay with no dialog or menu overlay. Twinsen is upright and there are no unsafe pose signs.","observed":{"twinsen_visible":true,"target_visible":true,"ui_state":"gameplay","unsafe_pose_signs":false},"mismatches":[]}