{"schema":"game-drive-visual-classification-v1","checkpoint_id":"capability_behavior_accel_otringal_normal","matches":true,"confidence":"high","summary":"Twinsen is visible near the lower center of the live game window, facing into an open outdoor Otringal plaza with clear walking space ahead. The target area is visible and open, with no immediate wall, dialog, menu, or overlay blocking movement. The UI state is gameplay, and Twinsen shows no unsafe pose signs such as falling, clipping, or being stuck.","observed":{"twinsen_visible":true,"target_visible":true,"ui_state":"gameplay","unsafe_pose_signs":false},"mismatches":[]}