{"schema":"game-drive-visual-classification-v1","checkpoint_id":"capability_magic_ball_throw","matches":true,"confidence":"high","summary":"Twinsen is visible near the three wall/pedestal switches, the middle switch target is visible among them, the screen is in normal gameplay with no dialog or menu UI, and there are no unsafe pose signs.","observed":{"twinsen_visible":true,"target_visible":true,"ui_state":"gameplay","unsafe_pose_signs":false},"mismatches":[]}