{"schema":"game-drive-visual-classification-v1","checkpoint_id":"capability_behavior_accel_otringal_discreet","matches":true,"confidence":"high","summary":"Twinsen is visible near the lower center of the screen, facing into an open outdoor Otringal city walkway. The target area is visible because there is clear open walking space ahead with no immediate wall, dialog, or menu blocking movement. The UI state is gameplay, and there are no unsafe pose signs such as falling, clipping, combat impact, or incapacitation.","observed":{"twinsen_visible":true,"target_visible":true,"ui_state":"gameplay","unsafe_pose_signs":false},"mismatches":[]}