{"schema":"game-drive-visual-classification-v1","checkpoint_id":"capability_behavior_accel_otringal_sporty","matches":true,"confidence":"high","summary":"Twinsen is visible near the lower center of the live gameplay view, facing an open outdoor Otringal plaza/walking area. The target open space ahead is visible with no immediate wall, dialog, or menu blocking movement, and there are no unsafe pose signs such as falling, collision lock, or incapacitation.","observed":{"twinsen_visible":true,"target_visible":true,"ui_state":"gameplay","unsafe_pose_signs":false},"mismatches":[]}