{"schema":"game-drive-visual-classification-v1","checkpoint_id":"capability_magic_ball_throw","matches":true,"confidence":"high","summary":"Twinsen is visible standing in the Emerald Moon room near the three wall/pedestal switches, and the middle switch target is visible among them; the screenshot is in normal gameplay view with no dialog or menu UI, and Twinsen shows no unsafe pose signs.","observed":{"twinsen_visible":true,"target_visible":true,"ui_state":"gameplay","unsafe_pose_signs":false},"mismatches":[]}