{"schema":"game-drive-visual-classification-v1","checkpoint_id":"capability_behavior_accel_otringal_aggressive","matches":true,"confidence":"high","summary":"Twinsen is visible near the lower center of the live game view, facing an open outdoor Otringal walking area. The target space ahead is visible and open enough for forward movement, with no immediate wall, dialog, or menu blocking movement. The UI is in gameplay state, and Twinsen shows no unsafe pose signs such as falling, damage, or stuck animation.","observed":{"twinsen_visible":true,"target_visible":true,"ui_state":"gameplay","unsafe_pose_signs":false},"mismatches":[]}