{"schema":"game-drive-visual-classification-v1","checkpoint_id":"capability_magic_ball_throw","matches":true,"confidence":"high","summary":"Twinsen is visible standing in the Emerald Moon switch room, the row of three pedestal switches is visible ahead/left of him including the middle switch target, and the view is normal gameplay with no dialog or menu overlay. Twinsen appears upright and controllable, with no unsafe pose signs such as falling, stuck animation, or incapacitation.","observed":{"twinsen_visible":true,"target_visible":true,"ui_state":"gameplay","unsafe_pose_signs":false},"mismatches":[]}