{"schema":"game-drive-visual-classification-v1","checkpoint_id":"capability_behavior_accel_otringal_aggressive","matches":true,"confidence":"high","summary":"Twinsen is visible near the lower center of the live gameplay view, standing in an open outdoor Otringal plaza with clear walking space ahead and no immediate wall blocking forward movement. The target open area is visible, the UI is normal gameplay with no menu or dialog overlay, and there are no unsafe pose signs such as falling, clipping, or incapacitation.","observed":{"twinsen_visible":true,"target_visible":true,"ui_state":"gameplay","unsafe_pose_signs":false},"mismatches":[]}