{"schema":"game-drive-visual-classification-v1","checkpoint_id":"capability_behavior_accel_normal","matches":true,"confidence":"high","summary":"Twinsen is visible near the center-left of the gameplay view, facing the row of three switch pedestals. The target switch is visible as the middle switch among the three wall/pedestal switches ahead of Twinsen. The screen shows normal gameplay with no dialog or menu overlay, and Twinsen is standing normally with no unsafe pose signs.","observed":{"twinsen_visible":true,"target_visible":true,"ui_state":"gameplay","unsafe_pose_signs":false},"mismatches":[]}